fund_name,fund_url,AUM (€),linkedin_url,investment_geographies,fund_description,fund_portfolio
Hannoversche Lebensversicherung AG,https://www.vestbee.com/lp-list/hannoversche-lebensversicherung-ag,,https://www.linkedin.com/company/hannoversche-lebensversicherung-ag/,"NAMER, Europe, Germany",Hannoversche Lebensversicherung AG is a part of the VHV Group. It is an insurance company based in Hanover. We use cookies for analytics and to improve your experience. You agree to the use of cookies by browsing this website or closing this banner.,
Harbour Vest Partners,https://www.vestbee.com/lp-list/harbour-vest-partners,100000000000,https://www.linkedin.com/company/harbourvest-partners/,"UK, Global","HarbourVest is an independent global private markets firm. The company offers its clients access to a wide range of investment opportunities, including primary funds, secondary transactions, direct co-investments, real assets, and private credit. We use cookies for analytics and to improve your experience. You agree to the use of cookies by browsing this website or closing this banner.",
Hellen's Rock,https://www.vestbee.com/lp-list/hellen-s-rock,,https://www.linkedin.com/company/hellensrock/about/,"Romania, Europe",Hellen's Rock is a single family office of sacha Dragic. The company has a diversified allocation strategy - including startups and VC funds. We use cookies for analytics and to improve your experience. You agree to the use of cookies by browsing this website or closing this banner.,
id4 Ventures,https://www.vestbee.com/lp-list/id4-ventures,,https://www.linkedin.com/company/id4ventures/about/,"France, Europe",id4 Ventures is a venture capital firm that specializes in pre-seed stage investing across Europe. The company also invests in VC funds. We use cookies for analytics and to improve your experience. You agree to the use of cookies by browsing this website or closing this banner.,"Cahnge Ventures; DN Capital; HC Capital; Hoxton Capital Management; KFund; Parade Ventures; Posssible Ventures; Runa Capital; The Fund; ""id4 Ventures""; ""Fund of funds""; Accelerators & Corporates"""
Illusian Family Office,https://www.vestbee.com/lp-list/illusian-family-office,,https://www.linkedin.com/company/illusian-family-office/?originalSubdomain=fi,"Finland, Global","Illusian is a family office of Ilkka Paananen, entrepreneur, investor, and co-founder & CEO of Supercell, the global leader in mobile games. We use cookies for analytics and to improve your experience. You agree to the use of cookies by browsing this website or closing this banner.",
